id,latitude,longitude,text
6.3896989706686874E17,51.379444,0.099444,Wind 0 km/h ---. Barometer 1018.3 mb  Rising slowly. Temperature 10.7 °C. Rain today 0.0 mm. Humidity 98%
6.3896998404836147E17,51.513514,-0.11581,New cake trolley at the office building every Friday afternoon. I don't think this will be good for me m)
6.3897000681499034E17,51.525059,-0.077206,@fitnesslifeyou  Hey guys any more great ab workout exercises?
6.3897003155705037E17,51.509347,-0.595448,We're #hiring! Click to apply: HCM Sales Representative UK Named/Major accounts - http://t.co/h19yx0LqN0 #Sales #Slough #Job #Jobs
6.3897005425258906E17,51.396667,-0.237222,Fairly fine  showers likely. Now: 11.3C Today Hi:12.3C - Lo:8.9C - Rain =0.01 ins.   Details - http://t.co/CLDk82uHMR
6.389700550285353E17,51.401495,0.235825,@AlfTuck happy birthday Alf 😘 xx
6.3897011485190963E17,51.532358,-0.12354,In london by 8am.. I could totally do this everyday! It's exciting :3 eeeeep. @ London King's Cross… https://t.co/mXuVPXabh5
6.3897013178413875E17,51.5063,-0.1271,Trend Alert: #Change5SOSLyricsToFries. More trends at http://t.co/do7Hdxwcnc #trndnl http://t.co/gh6DujlgwH
6.3897014051670426E17,51.632002,0.615531,Times & Heights for River Crouch on 2nd September 2015 03:51 - High (5.90m) 10:08 - Low (0.40m) 16:10 - High (5.90m) 22:39 - Low… #Tides
6.3897015431179469E17,51.500152,-0.126236,#Banking #Job alert: Middle Office Specialist- New Cases  CIC | Standard Chartered Bank | #CityofLondon http://t.co/snfMEFpIGd #Jobs
6.3897015638378086E17,51.500152,-0.126236,Carpenter - Hays: (#London  UK) http://t.co/RrJL3rrZKK #SkilledTrade #Job #Jobs #Hiring #CareerArc
6.3897015853121536E17,51.500152,-0.126236,Join the Expedia Europe team! See our latest #job opening here: http://t.co/uM2h0Gtp88 #ExpediaJobs #London #Hiring
6.3897015973921997E17,51.500152,-0.126236,QA Engineer 1 - http://t.co/N4bn3ERwdK: (#London) http://t.co/6U5HyiulME #QA #ExpediaJobs #Job #Jobs #Hiring
6.3897017218367898E17,51.518243,-0.080933,The meticulously hand-coloured bomb damage maps of London – in pictures http://t.co/qaYK4nbFVP #London http://t.co/aGHBI6bJaY
6.3897017913786778E17,51.50135,-0.142844,#Facebook Launches New TV Ad Campaign http://t.co/7flSZzwbJ9 http://t.co/OiMJY4euH1
6.3897022802678989E17,51.58865,-0.003935,This beautiful #echivera to brighten up your Wednesday morning. Still so excited about @timeoutlondon… https://t.co/ZBsqFavz6M
6.3897031302437274E17,51.4785,0.0068,There she goes...#BigDay #backtoschool #NewStart @ John Roan School https://t.co/xbpmBeuYQJ
6.3897038188225741E17,51.500077,-0.178666,@paulbaylay to the news about the boys i'm always ready
6.3897039644066611E17,51.690523,-0.418492,Bom dia com gosto de cerveja amanteigada!! ☺️🌻 📍 Visitei os estúdios Warner Bros. em Londres  onde… https://t.co/d59U1sMENk
6.3897040739189965E17,51.657755,-0.268683,#StarWars: Episode VIII New Female Lead Shortlist Revealed http://t.co/PjMKIpGqg8 #XmasNo1 http://t.co/xRtNfWDr1x
6.3897041642221978E17,51.509347,-0.595448,This #ProjectMgmt #job might be a great fit for you: Facilities Manager - http://t.co/ZEg4AaZqQ9 #Slough #Hiring #CareerArc
6.3897042168188518E17,51.509347,-0.595448,Can you recommend anyone for this #IT #job? http://t.co/FDG1ATQosr #Slough #Hiring #CareerArc
6.3897046448485581E17,51.499603,-0.163053,Gravity by Jamie Woon is #nowplaying in Harrods  London.  Download it now at http://t.co/OLL4edL1uv
6.3897048124951757E17,51.514965,-0.130163,Après-gig Soho shenanigans with @scottmcfarnon & @andybrooksonic @ The Crobar https://t.co/pALDPAMXjG
6.389704840219689E17,51.4193,-0.161053,My morning commute track is being bathed with refreshing morning light.   #commute #tooting #London… https://t.co/8Xuy3zDxZS
6.3897050325703885E17,51.51874,-0.083609,Early morning boxing 1rebeluk #Rumble @ Broadgate Circle https://t.co/wg4EeEXvlL
6.3897050509413171E17,51.500701,-0.078368,Loving this #amazing #wooden #axe #table  leg detail!!! 👌🏻💯 #wood #woodworking #woodworkingtools… https://t.co/JRCjpF4Ff3
6.3897050601675571E17,51.500139,-0.124501,EU referendum: out campaigners welcome Cameron's reworded question http://t.co/wURa60epxI #Politics http://t.co/7KMZKX0xXV
6.3897051308831949E17,51.500139,-0.124501,Confused about the Canning byelection? Read on to become more confused | First Dog… http://t.co/3Xa78GarhK #Politics http://t.co/04lrEt7x6U
6.3897052485348966E17,51.5042,-0.2207,Today's Mood... #upabovetheworld #blog #blogger #sick #hatethisweather… https://t.co/ZMzoHhIx0V
6.3897064544391168E17,51.503425,-0.119469,Last week I found myself on the London Eye  gazing down on London town like a bird in the sky... I've… https://t.co/AcLElDlyqr
6.3897068942961869E17,51.556883,-0.005176,✔️ Cottage Cheese on Rye Bread!!   This protein packed cheese provides about 26g of protein per cup.… https://t.co/tM6ysJxgCT
6.3897075006246912E17,51.522857,-0.07784,@_fitnessempire  Hey guys any tips to blast the butt and biceps? Thanks
6.3897075286828646E17,51.749939,-0.33537,£800pcm  Park Street (AL2): "I Am a Professional Woman  Easy Going and Friendly" http://t.co/dJtv92W9C1 #stalbans #rental
6.389707659461632E17,50.927523,-1.474475,[Southampton FC] Southampton break record to sign Van Dijk http://t.co/8RhVjUADW3 #saintsfc http://t.co/Yssoq1Hcpc
6.3897089012284211E17,51.690523,-0.418492,Bom dia com gosto de cerveja amanteigada!! ☺️🌻 📍 Visitei os estúdios Warner Bros. em Londres  onde… https://t.co/IVnfDAHMe5
6.3897091058674893E17,51.509347,-0.595448,Database Administrator - Telefonica: (#Slough) http://t.co/vEafdKMGp6 #Database #Job #Jobs #Hiring #CareerArc
6.3897091458390835E17,51.483448,-0.082088,Resourcing Solutions: Estimator (#Southwark  UK) http://t.co/JNGdXwweUz #Insurance #Job #Jobs #Hiring #CareerArc
6.3897094495499878E17,51.580544,0.19957,Berahino refuses to play again for West Brom Chairman  ridiculous Berinio shud thank the geezer for stopping him playing for Spuddys
6.389709779599401E17,51.102468,-0.802357,I just began a running workout using #Endomondo. Peptalk me now @ http://t.co/DWL3a3JpUm
6.3897097832071168E17,51.506365,-0.115678,Best slide ever! Carsten Höller at the @southbankcentre  closes this weekend💥🎉 @ Haywood Gallery https://t.co/u4jmsBb8fD
6.3897098643243827E17,51.420192,-0.890493,I'm at Pulse 8 in Wokingham  UK https://t.co/OBAvKc20wW
6.3897102901306982E17,51.514752,-0.124712,Planning meetings  client meetings  people meetings. Lotsa meetings (@ The Hospital Club) https://t.co/R0QGlxXl8q http://t.co/PkbwO6Qha3
6.3897103216297165E17,51.471854,-0.486449,@martynrevans @leonintheblind Well  that was prescient. I literally just landed in Heathrow. :)
6.3897112705069875E17,51.583354,-0.072492,#SevenSisters 08:13 to #LiverpoolStreet is 10 minutes late . http://t.co/JQrPjoYHGj
6.389711297307607E17,51.5485,-0.479611,Join the Telefonica team! See our latest #Media #job opening here: http://t.co/7M47bOhCky #Uxbridge #Hiring #CareerArc
6.3897113784254464E17,51.495065,-0.137329,#Stigmabase | UK -  LGBTI symbolism not enough: action group  - BLAG says symbols are not enough  and action was… http://t.co/nthuHK9Vzo
6.3897114311476838E17,51.495065,-0.137329,#Stigmabase | UK -  Jaymi Hensley talks gay rights and crushing on Gareth Gates  - When fans message me about how… http://t.co/SSMqsel5P7
6.3897114699043635E17,51.5132,-0.2043,For the full video  check it on Nostalgia's Facebook page.  Notting Hill Carnival blues kicking in.… https://t.co/mxzslc2EHD
6.3897116169132851E17,51.536563,0.075766,This #Automotive #job might be a great fit for you: Trailer Mechanic (UK) Barking - http://t.co/mZ3LoXQIud #Barking #Hiring #CareerArc
6.3897119803090125E17,51.504543,-0.174407,Pink Matter @ Serpentine Pavillion https://t.co/r3anCsNyFZ
6.3897121548746342E17,51.441974,-0.089551,StockMarketWire FLASH: Severfield trading in line with management views http://t.co/A56TAOo1fU http://t.co/GJtVCdlZFY
6.389712156762153E17,51.495065,-0.137329,#Stigmabase | UK -  LGBTI symbolism not enough: action group http://t.co/CA8fuUM4tv
6.3897121712741171E17,51.441974,-0.089551,StockMarketWire FLASH: REM increases strategic holding in Bacanora http://t.co/RSDGNmB7B2 http://t.co/GJtVCdlZFY
6.3897121741268582E17,51.495065,-0.137329,#Stigmabase | UK -  Jaymi Hensley talks gay rights and crushing on Gareth Gates http://t.co/EAPciVO30X
6.3897121867936973E17,51.441974,-0.089551,StockMarketWire FLASH: Aggreko acquires ICS http://t.co/dccMHRdnEP http://t.co/GJtVCdlZFY
6.3897122002152243E17,51.441974,-0.089551,StockMarketWire FLASH: SpaceandPeople inks contract with Network Rail http://t.co/lKDAtCAL12 http://t.co/GJtVCdlZFY
6.3897122162796134E17,51.441974,-0.089551,StockMarketWire FLASH: Construction starts at Kiziltepe  says Ariana http://t.co/SotdWhBF2x http://t.co/GJtVCdlZFY
6.3897122329310413E17,51.441974,-0.089551,StockMarketWire FLASH: Tungsten Corp updates on board changes http://t.co/AFEyxnNDyP http://t.co/GJtVCdlZFY
6.3897122474852762E17,51.441974,-0.089551,StockMarketWire FLASH: SQS completes acquisition of Galmont Consulting http://t.co/jHX7CnbCD1 http://t.co/GJtVCdlZFY
6.3897122638424064E17,51.441974,-0.089551,StockMarketWire FLASH: CEB in Tuba Obi East concession agreement http://t.co/CM6DfT4put http://t.co/GJtVCdlZFY
6.3897122795716198E17,51.441974,-0.089551,StockMarketWire FLASH: Edge sales fall http://t.co/JIExyPYQTV http://t.co/GJtVCdlZFY
6.3897122943356518E17,51.441974,-0.089551,StockMarketWire FLASH: MWA Africa details capital hike for £3.67m gross http://t.co/LXpmAWsp28 http://t.co/GJtVCdlZFY
6.3897129461297971E17,51.441974,-0.089551,StockMarketWire FLASH: VLS says manufacture of reactors and catalyst complete http://t.co/iV8FTb4zt2 http://t.co/GJtVCdlZFY
6.3897129779233178E17,51.441974,-0.089551,StockMarketWire FLASH: Tandem Group acquires ESC (Europe) Ltd http://t.co/I0I2XD9nLU http://t.co/GJtVCdlZFY
6.3897130017043661E17,51.441974,-0.089551,StockMarketWire FLASH: Halfords cycling sales hit by bad weather http://t.co/HZMkiyFkxO http://t.co/GJtVCdlZFY
6.3897130256963994E17,51.441974,-0.089551,StockMarketWire FLASH: EMED operations update http://t.co/2GhJBjYzc0 http://t.co/GJtVCdlZFY
6.389713044780073E17,51.441974,-0.089551,StockMarketWire FLASH: Ryanair lifts August traffic by 10% to 10.4m customers http://t.co/9As65MBGer http://t.co/GJtVCdlZFY
6.3897130652483994E17,51.441974,-0.089551,StockMarketWire FLASH: Fishing Republic revenues up http://t.co/nV245z53rh http://t.co/GJtVCdlZFY
6.3897130803895091E17,51.441974,-0.089551,StockMarketWire FLASH: Nektan confirms launch of Nektan Marketing Services http://t.co/PTGYToHfBO http://t.co/GJtVCdlZFY
6.389713096370135E17,51.441974,-0.089551,StockMarketWire FLASH: Diploma revenues up http://t.co/ujYDcJOSpn http://t.co/GJtVCdlZFY
6.3897131123920077E17,51.441974,-0.089551,StockMarketWire FLASH: Range Resources says new drilling rig arrives in Trinidad http://t.co/CF7twU1jL5 http://t.co/GJtVCdlZFY
6.3897131280789504E17,51.441974,-0.089551,StockMarketWire FLASH: Ashtead underlying earnings rise http://t.co/kVzGyih7sx http://t.co/GJtVCdlZFY
6.3897138052924211E17,51.520964,-0.078888,Just a reminder guys of my butt kicking work out tomorrow at the elise centre  dalston lane from 6.30pm - 7.30pm
6.3897138258853478E17,51.441974,-0.089551,StockMarketWire FLASH: Empyrean update on Sugarloaf output http://t.co/Rr3tKnBw4s http://t.co/GJtVCdlZFY
6.3897138487864115E17,51.441974,-0.089551,StockMarketWire FLASH: Johnson Service Group revenues up http://t.co/1kovBwAkmU http://t.co/GJtVCdlZFY
6.3897138609498112E17,51.441974,-0.089551,StockMarketWire FLASH: Biome margins improve http://t.co/4KP6Bj50II http://t.co/GJtVCdlZFY
6.3897138736581837E17,51.441974,-0.089551,StockMarketWire Severfield trading in line with management views http://t.co/olWPjgUeNg http://t.co/GJtVCdlZFY
6.3897138808321638E17,51.5615,-0.0731,Nice wee drop this one. Bit heavy for seafood though  and for a Tuesday night for that matter!… https://t.co/SXV9Sd6LOq
6.3897138873320653E17,51.441974,-0.089551,StockMarketWire FLASH: DCC gets clearance for acquisition of Butagaz http://t.co/7boJZQB6v7 http://t.co/GJtVCdlZFY
6.3897138996632371E17,51.441974,-0.089551,StockMarketWire MWA eyes hike http://t.co/KG2tFIzFdc http://t.co/GJtVCdlZFY
6.3897139117010125E17,51.441974,-0.089551,StockMarketWire Ryanair lifts August traffic by 10% to 10.4m customers http://t.co/tg0zg0tGBn http://t.co/GJtVCdlZFY
6.3897139237804032E17,51.441974,-0.089551,StockMarketWire Halfords cycling sales hit by bad weather http://t.co/QpFwwUUAIO http://t.co/GJtVCdlZFY
6.3897139376632627E17,51.441974,-0.089551,StockMarketWire Gledhow director steps down for health reasons http://t.co/C2Bs45PO3O http://t.co/GJtVCdlZFY
6.3897139501622886E17,51.441974,-0.089551,StockMarketWire Range Resources says new drilling rig arrives in Trinidad http://t.co/tJjDtHMtdl http://t.co/GJtVCdlZFY
6.3897141156295475E17,51.474015,-0.202044,😎👊 morning 🎵 last checks to GREAT  tunes from the amazing 👇🏽😃 @FinylTweek 🔊🎶💥 http://t.co/v0ljsvWWCB
6.3897141464152883E17,51.513611,-0.155556,vibes in London 🇬🇧 #alwaysdigging @ Oxford Street https://t.co/wpmTymLjK9
6.3897150056602829E17,51.495178,-0.182331,#greatness @mrmichaelkagan 🖖🏾 @ South Kensignton London https://t.co/Yu7NcZTBnO
6.3897150979352986E17,51.541302,-0.026733,#mates #rugby #Heineken #olympicstadium @ Queen Elizabeth Olympic Park https://t.co/fCPkN8Q5jK
6.3897150990666547E17,51.441974,-0.089551,StockMarketWire Tandem Group acquires ESC (Europe) Ltd http://t.co/TGbRymlrhf http://t.co/GJtVCdlZFY
6.3897151275876762E17,51.441974,-0.089551,StockMarketWire JSG's strong H1 http://t.co/gF8R1Etw6h http://t.co/GJtVCdlZFY
6.3897151537181901E17,51.441974,-0.089551,StockMarketWire VLS says manufacture of reactors and catalyst complete http://t.co/ZRg9651KpJ http://t.co/GJtVCdlZFY
6.3897151784227635E17,51.441974,-0.089551,StockMarketWire SpaceandPeople inks contract with Network Rail http://t.co/GLYQ9h9Rgb http://t.co/GJtVCdlZFY
6.3897152058117325E17,51.441974,-0.089551,StockMarketWire Aggreko acquires ICS http://t.co/5alMSIP5Lp http://t.co/GJtVCdlZFY
6.3897152392820736E17,51.441974,-0.089551,StockMarketWire REM increases strategic holding in Bacanora http://t.co/yAqdpnTgWn http://t.co/GJtVCdlZFY
6.3897152584500429E17,51.441974,-0.089551,StockMarketWire Construction starts at Kiziltepe  says Ariana http://t.co/lbR7ac8HjO http://t.co/GJtVCdlZFY
6.389715286425641E17,51.441974,-0.089551,StockMarketWire Arian Silver clarifies directors' resignation date http://t.co/GufbUmWi1F http://t.co/GJtVCdlZFY
6.3897153045873869E17,51.441974,-0.089551,StockMarketWire Ashtead underlying earnings up 25% http://t.co/YLkuDEw8Qb http://t.co/GJtVCdlZFY
6.389715338225623E17,51.441974,-0.089551,StockMarketWire Fishing Republic pre-tax profits up 38% http://t.co/mEuhNfk4KI http://t.co/GJtVCdlZFY
6.3897154648109875E17,51.58888,0.027199,Ooh. There's gonna be a BBC adaptation of And Then There Were None. #yesss
6.3897158784531251E17,51.771697,-0.240723,I just finished cycling 4.04 miles in 22m:21s with #Endomondo #endorphins http://t.co/eLDuxDNZpn
6.3897160899298099E17,51.52379,-0.09848,“I’m going to have to science the shit out of this.” - Matt Damon in The Martian Official Trailer https://t.co/8cgRhYLQSZ
6.3897161006674739E17,51.558178,-0.282206,X Factor Show UK Edition 🇬🇧 @liquicious @ The SSE Arena  Wembley https://t.co/xcnAdZHLn4
6.3897163281247437E17,51.496562,-0.145055,Stop says closed but buses calling. Bus missed as i went to temporary stop. Thanks @tfl https://t.co/UOjcswf8Ui http://t.co/56tkeILpD9
6.3897163842849587E17,51.418339,-0.220629,#Utilities #Job in #Wimbledon  UK: Electrician at Resourcing Solutions http://t.co/aANeKjKEgx #Jobs #Hiring #CareerArc
6.3897164738752512E17,51.441974,-0.089551,StockMarketWire Concurrent Technologies turnover up 72% http://t.co/Dmp9dWo7h1 http://t.co/GJtVCdlZFY
6.389716491828265E17,51.516197,-0.152606,Alligators in #london. Totally loving this little piece of #Florida in… https://t.co/P3LXLr2mJ1
6.389716516447232E17,51.441974,-0.089551,StockMarketWire CEB's '100-day plan' hits initial goals http://t.co/0I2n2wF0WW http://t.co/GJtVCdlZFY
6.3897165520572826E17,51.441974,-0.089551,StockMarketWire Diploma revenues buoyed by acquisitions http://t.co/Gsr0ToDxpU http://t.co/GJtVCdlZFY
6.3897165766780518E17,51.441974,-0.089551,StockMarketWire Imaginatik schedules AGM http://t.co/4MP2kPQ3DI http://t.co/GJtVCdlZFY
6.3897166048631603E17,51.441974,-0.089551,StockMarketWire LiDCO expects FY to be broadly breakeven http://t.co/27jTIy9VGC http://t.co/GJtVCdlZFY
6.3897166403895706E17,51.441974,-0.089551,StockMarketWire Bango in Google Play carrier billing launch in Africa http://t.co/JYFTD9ed8n http://t.co/GJtVCdlZFY
6.3897166582569779E17,51.441974,-0.089551,StockMarketWire IAG offer for Aer Lingus closed http://t.co/syQei7fjnA http://t.co/GJtVCdlZFY
6.3897166783491277E17,51.258008,-0.896222,... دَومْاً لَكَ الحَمْدُ ما دَقَّت النَّبَضاتْ ... صباح الورد...🌼☀️ @ Four Seasons Hotel Hampshire … https://t.co/uN3OaDD1y6
6.3897166821648384E17,51.441974,-0.089551,StockMarketWire AMS gets CE approval for antimicrobial foam http://t.co/ZJh8mXko5n http://t.co/GJtVCdlZFY
6.3897166962151014E17,51.441974,-0.089551,StockMarketWire Conygar appoints FD http://t.co/21NQ2Qdukt http://t.co/GJtVCdlZFY
6.3897167125733376E17,51.441974,-0.089551,StockMarketWire Edge revenues fall http://t.co/qIFenBKDlh http://t.co/GJtVCdlZFY
6.3897169349566054E17,51.528192,-0.216011,🎶 Don't congratulate yourself too much  or berate yourself either  your choices are half chance -and so are everybody else's 🎶 #sunscreen
6.389717214045184E17,51.413648,-0.197918,On a rainy summer morning  is the little things that brighten up my day ❤️.     Gracias kass_d… https://t.co/SHkApPc4TO
6.3897190202385613E17,51.991781,-0.699106,Overnights aren't so bad 🌄😴 @ Mcdonald's Brickhill https://t.co/fpswT4SsS7
6.3897191606207693E17,51.500152,-0.126236,Scrum Master - http://t.co/TVx14EBdQ4: (#London) http://t.co/5iZGoMZBVW #WebDesign #ExpediaJobs #Job #Jobs #Hiring
6.3897194752366592E17,51.499105,-0.183702,Best ribs in town! (@ Crib de Rib Restaurant in London  UK) https://t.co/Cp7IEy8pPI
6.3897196193113293E17,51.81419,-0.40732,Dear M1 road works I hate you and everything you stand for #SomeOfUsNeedToGoToStrictly
6.3897205179407565E17,51.4945,-0.210902,Ahhh back to work today...hopefully I won't be savaged by my colleagues for my 'superior attitude'....am gonna wear my new tag with pride 😀
6.3897206919205274E17,51.656151,-0.277694,I'm at Borehamwood in Borehamwood  Hertfordshire https://t.co/ZTtX3Nztk2
6.3897207670402662E17,51.632089,0.06011,Buster chose this as his walk this morning 🐶 @ Roding Valley Lake https://t.co/yAneQsZpwy
6.3897209846407578E17,51.655919,-0.275298,I'm at Caffè Nero in Greater London https://t.co/2jBpKqY1Wr
6.3897215398395085E17,51.51739,-0.141436,Full Time Model Booking Assistant - Sapphires Model Management: (#London  London) http://t.co/vPTHYsyi8l #Music #Job #Jobs #Hiring
6.3897215377845043E17,51.809782,-0.237674,Want to work in #Hertfordshire  UK? View our latest opening: http://t.co/UbMQsGSyM6 #Transportation #Job #Jobs #Hiring #CareerArc
6.3897215581267149E17,51.761206,-1.246467,Interested in a #Art #job near #Oxfordshire  UK? This could be a great fit: http://t.co/FzcpLrsugI #Hiring #CareerArc
6.3897215804827648E17,51.500152,-0.126236,We're #hiring! Read about our latest #job opening here: Director  Regulatory Affairs - http://t.co/5QX9hwYMSK #London #Healthcare
6.3897217257324134E17,51.539516,-0.160419,Lovely crisp morning on primrose hill. I should really get up early more often! #london #primrosehill… https://t.co/T6nJl3e2fQ
6.3897224198898893E17,51.542032,-0.004302,@_atiz_ хаха Какво беше който се дърпа.....
6.3897225732338483E17,51.504372,-0.1748,#lynetteyiadomboakye @ Serpentine Galleries https://t.co/IGAiAhmtBx
6.3897229035772314E17,51.434,-0.532725,would love a job that's enjoyable & very rewarding #LegUp like working with injured animals...if only my qualifications didn't let me down!!
6.3897230836385382E17,51.510113,-0.120537,Gypsy! 🇬🇧🎶👏 (@ Savoy Theatre in London  Greater London) https://t.co/RrpXNV7ugd
6.3897233146186547E17,51.632089,0.06011,Good Morning @ Roding Valley Lake https://t.co/gvMlGbCZ8f
6.3897233451531059E17,51.541302,-0.026733,View from my yoga mat (a limited series). Brilliant blue sky. #Summer2015 #London @ Queen Elizabeth… https://t.co/BIzbG4D7dr
6.3897234624680755E17,51.5321,-0.1066,#quiet #morning #london #city #architecture #empty #street #londonigers #photooftheday #walks @… https://t.co/01nbCCMKuD
6.3897240735360614E17,51.48243,0.272742,Family. @ Mc Truck and Bus https://t.co/zQcTaz2bMy
6.3897241670271795E17,51.522263,-0.0758,This is probably the best vine I have ever seen in my life! "Not all muscles were made in the gym"  https://t.co/x7gEcPbDMN”
6.3897245881355469E17,51.577267,0.06866,Never a dull moment with this one 😂❤️ @ Faces  Gants Hill https://t.co/fOMxpqXh1D
6.3897249014916301E17,51.508061,-0.10821,Morning! It's a beautiful day in London! #london #tatemodern #ceramics #mug @ Snowden Flood Design https://t.co/T5zVTWwwBd
6.3897252440827085E17,51.446584,-0.01997,صباح الخير يا بشوات ❤️👌🏼 @ Big Ben   London https://t.co/XLxkAdZDik
6.3897268202596352E17,51.50746,-0.162134,😴 (@ Hyde Park in Hyde Park  Greater London) https://t.co/1dbdpAh38k
6.3897273012627046E17,51.513746,-0.099052,24 @ St. Paul's Cathedral https://t.co/ihhuYCHGAa
6.3897275323690189E17,51.889564,0.260882,Fucking pretty nice sunny lovely day! (@ London Stansted Airport (STN) - @stn_airport) https://t.co/CHIpOyYJkK http://t.co/LQFCd0024a
6.3897278122128998E17,51.47171,-0.468103,I'm at London @HeathrowAirport (LHR) in Hounslow  London https://t.co/K8oBuN9vv5
6.3897290852682957E17,51.515187,-0.103492,The post gives all the information you need to know #lastday #newstarts @… https://t.co/5jQmLrjK1a
6.3897292663361946E17,51.474774,-0.220543,No surprise that I engineered this gem to be on the route... #Fulham #FFC @ Craven Cottage https://t.co/FOAnF5dpOc
6.3897307151744614E17,51.43661,-0.176402,Can't believe I have to get up early for one piddly little lecture. Boo.
6.3897309481683763E17,51.503924,-0.113488,Sardine City on @SW_Trains! And so it starts!
6.3897312134159565E17,51.506416,-0.231564,Just a girl and her guitar🎸 @torikelly was absolutely amazing last night!… https://t.co/OO2MoUvvpx
6.3897320163315712E17,51.7833,-0.65,Back to the book of ideas  lists & planning! Have already ordered next years book. It makes me think… https://t.co/57u3GjeHlJ
6.3897321823000576E17,51.518921,-0.207838,Notting Hill Carnival with katarinavrkic 🎉 @ Nottinghill Carnivaaaalll https://t.co/S1eSnmA3rI
6.3897323780066099E17,51.095484,-0.178594,Ella vs food 😝 #bellybuster #icecream #sundae #bankholiday #mondayfunday #tillgatepark #crawley… https://t.co/UcJSd5FnOm
6.3897324644929536E17,51.507701,-0.017209,That's "Poplar" like the tree  not "popular" like me ... (@ Poplar DLR Station in Poplar  Greater London) https://t.co/u5S5Vgdx7w
6.3897325151603917E17,51.761214,-0.328744,Dark forces @ Bernards Heath Park https://t.co/sUFfhQyNht
6.3897326276095181E17,51.438168,0.176102,Apple Maps team out in full force around Kent. #applemaps http://t.co/2lbnyaE8Ap
6.3897326797023642E17,51.643189,-0.432454,Two Gunslingers by Tom Petty And The Heartbreakers is #nowplaying in Anytime Fitness Demo.  Download it now at http://t.co/3wcNf0rzsl
6.3897328142978253E17,51.508611,-0.163611,Morning coffee in the park #autumn #fall #London ☕️💛☀️ @ Hyde Park  London https://t.co/t2U7Ta1tGi
6.3897331836066202E17,51.543307,-0.059486,"Duvet Daze"Autumnal #Denim Coat Vibes via 👉 @hannakovanen 💕 Last ones left on the .com @ £67.50 🍑👀… https://t.co/diSXEi2Sr5
6.3897334256173875E17,51.442492,0.188833,MATCH DAY ! @phoenixsport82 vs @GuernseyFC    FA CUP replay being held at @Lewes_cfc 7.45 ko
6.3897335296365363E17,51.332222,-0.557778,Temp 14.5°C Wind 1mph Press 1014.5hpa Steady Cloud 591 ft Rain 0.0mm Humidity 91% #Woking #UKWeather
6.3897349853951181E17,51.575386,-0.321873,Waiting for Auntie's operation (@ Northwick Park Hospital in Harrow  Middlesex) https://t.co/pnsDI9ewpi
6.389735398744064E17,51.51553,-0.141042,Photo booth✌️ @ Topshop (Oxford Circus) https://t.co/UOUB4qatKv
6.389735417660457E17,51.554851,-0.108487,Niccie at her first North London Derby @ Emirates Stadium https://t.co/BjQeYIYUhf
6.3897356100953702E17,51.5702,-0.0583,Spinning is such a great way to start the day! I feel so energised and ready for anything. What's… https://t.co/4TKQ5vDpZQ
6.3897356643271066E17,51.513687,-0.131775,Pink drank @ Barrafina https://t.co/peXKlJsfIS
6.3897358170417562E17,51.546892,-0.066372,@_atiz_ ииииС отварачка е от към топките ако някой се дърха че го обезчестиме :) хаха това е за мъжки дупета....
6.3897363174221824E17,51.515256,-0.093286,Man was on the box #RiskyBusiness #assistantmanager @ Gresham Street  City of London https://t.co/Zh7l5buWGn
6.3897366686112563E17,51.379444,0.099444,Wind 0 km/h ---. Barometer 1018.3 mb  Rising slowly. Temperature 11.1 °C. Rain today 0.0 mm. Humidity 98%
6.3897371808616448E17,51.415137,-0.020143,Misty morning run. @ Beckenham Place Park https://t.co/5H9uDSbyzD
6.389737783204905E17,51.544797,0.049685,Iron Maiden frontman Bruce Dickinson feared he would beat cancer but lose his ... - Herald… http://t.co/hNrPbxUXOd http://t.co/uMoxv1MyQE
6.3897377825757594E17,51.602739,-0.067314,DeAndre Yedlin to Sunderland on loan after hearing ‘fantastic things’ http://t.co/3r2URqsJLP #COYS http://t.co/1la0gVLILW
6.3897377835398349E17,51.620208,0.301415,Day one tea report: Essex lose four wickets on rain hit day http://t.co/tzFItWptaW #Brentwood #Essex http://t.co/24avdNCxc3
