id,latitude,longitude,text
6.5283534493365043E17,51.51374587,-0.09905172,On le bus..... Passing St. Paul's Cathedral #london #stpaulscathedral @ St. Paul's Cathedral https://t.co/1PPBsWytUm
6.528353598400471E17,51.51481415,-0.19933258,Ottolenghi! 😍 The white chocolate raspberry cheesecake and lemon mascarpone tart were divine... We… https://t.co/HvziRAEzGy
6.528353882062807E17,51.4864715,-0.0091968,North Lift (Island Gardens) has stopped working. 10/10/2015 13:17:40 GMT
6.5283539165813965E17,51.497551,-0.09886,Last week was mad real djing in the box at the world famous @ilovemilkshake #ministryofsound when… https://t.co/QMmVXOcV1o
6.5283540058781286E17,51.41362911,-0.23571033,Kiddie party for Dani's birthday.😊🎉 (@ Cottenham Park) https://t.co/AWb0GOccid
6.5283540648921088E17,51.62440244,0.08095822,#RocWednesdays next Wednesday 🙌🏽 DJ rsali_1 @ Sheesh Chigwell https://t.co/GFHrqQGqIU
6.5283541439130829E17,51.4558811,-0.3434231,Well I'm here! http://t.co/h6iXQFFkJn
6.5283541828777165E17,51.5,-0.13,voice of her hair: if the wife of Alexander or Timour. Under his reign  acknowledged and worshipped many of the citizens; all ranks of the
6.5283542378234675E17,51.49849427,-0.10087877,Good noms! 🐵🐵 @ London South Bank University Students' Union https://t.co/EkQB7pKIyO
6.5283543344604365E17,51.40801001,0.0161239,@A_Sporting_Life I know! It had to be the race I've raised sponsorship for as I didn't get in via ballot. I had visions of crawling it !
6.5283545471531827E17,51.49235631,-0.15778186,And i say that as someone who loves an autograph or picture
6.528354552102912E17,51.50514919,-0.07558474,Last day in London. Last day of #talbotworldtour. Sad to go home tomorrow! @ Tower Bridge https://t.co/qkpymhBJ13
6.528354662077399E17,51.4832476,-0.0100725,South Lift (Cutty Sark) has stopped working. 10/10/2015 13:17:58 GMT
6.5283548245648998E17,51.5,-0.13,provincial synods  opposed with all the members of a female claim to be killed  it is impossible not to behold?
6.5283550191382118E17,51.5135994,-0.1272479,Turkish eggs 'changa style' yoghurt  hot chilli butter  sourdough   I've had my eye on kopapa since… https://t.co/i1WaPZJrYU
6.5283551382566912E17,51.4864715,-0.0091968,North Lift (Island Gardens) is working. 10/10/2015 13:18:10 GMT
6.5283553091730637E17,51.43022674,0.5825758,Pumpkin picking at #belunclefarm with @stuartmerrett84 and the #verystrong #notputoffbythesizeofit… https://t.co/lMJpbSb6IQ
6.5283553224690074E17,51.52192703,-0.1541586,True love😻💘 @ Madame Tussauds London https://t.co/EWqYtu0J1i
6.5283556182528E17,51.50775246,-0.14370492,Arriving at the weeding of my good friends Edmund and Sara. #style #fashion @ The Mayfair Hotel… https://t.co/a8YlacftjE
6.5283559195298611E17,51.4832476,-0.0100725,South Lift (Cutty Sark) is working. 10/10/2015 13:18:28 GMT
6.5283559600464282E17,51.510704,-0.129783,demo in london #justice #china http://t.co/NIMXzZJB1T
6.5283560230452838E17,51.54339852,-0.00631609,I'm at @Westfield Stratford City in Stratford  Greater London https://t.co/OLQxFkfvoz
6.5283561694264934E17,51.532222,-0.156667,London in the fall #london #fall #autumn #regentspark 🍁🍂 @ Regent's Park https://t.co/201UFJ8FME
6.5283563798126592E17,51.5367,-0.0618,RE-UNION 💘💘💘💘💘💕💕💕💕💕 Finally after such a long time. #happiestguysonearth @ Broadway Market https://t.co/YVIhYwBlcq
6.528356395960279E17,51.4864715,-0.0091968,North Lift (Island Gardens) has stopped working. 10/10/2015 13:18:40 GMT
6.5283565520725606E17,51.50469974,-0.08659775,Birthday treats 🎁 @ The Shard London https://t.co/rqQY1GE06h
6.5283567639671603E17,51.45830502,-0.30637354,Had to hide the England shirts one way or another! #RWC15 #44DaysofCrazy 🏉 @ Richmond On Thames https://t.co/welvQwBCf5
6.5283571177153741E17,51.45451382,-0.29963398,So close to London and so perfect 🇬🇧 @ Richmond Hill  London https://t.co/KZKUYFkRCs
6.5283571787852186E17,51.4832476,-0.0100725,South Lift (Cutty Sark) has stopped working. 10/10/2015 13:18:58 GMT
6.5283573790214144E17,51.7583733,-0.4716427,Cutest like tea room for Saturday breakfast #vsco #vscouk #vscofood #tea #saturday #breakfast @ The… https://t.co/xf13XYZSA3
6.5283574022163661E17,51.39006944,0.021075,Bromley⚽️ @ Bromley F.C. https://t.co/kmthjvvJXY
6.5283574046056038E17,51.28830304,-0.44965664,Leave anger on the pitch #nonleagueday #football #project #clapham #horsley #surrey @projectclapham @… https://t.co/Z6xB6cvbMI
6.528357630344233E17,51.60356649,0.11730002,Second to the last wedding booking of the year. And I tell u the last one… https://t.co/npXk6me26b
6.5283576503509402E17,51.4864715,-0.0091968,North Lift (Island Gardens) is working. 10/10/2015 13:19:10 GMT
6.5283577739993088E17,51.48922151,-0.17368144,Just posted a photo @ Chelsea Square https://t.co/bs8LJnWd8K
6.5283580383244698E17,51.53528744,-0.00647407,All packed up and ready to go 😢 don't think another thing would have fit in the van if we tried… https://t.co/VBlnkk58bE
6.528358150521815E17,51.46429669,-0.30865831,Matt Giteau eat your heart out. What a swandive  what a try to win the RWC for the wallabies #RWC2015… https://t.co/p5ZJcj8d7m
6.5283581754769408E17,51.50179674,-0.12171364,#bigben #london #تصويري @ Big Ben & House of Parlament  London Eye & Thames River https://t.co/QDNludqEj0
6.5283581830693683E17,51.49562055,-0.16015308,А вот кто б подсказал марку изделия #Лондон @ Cadogan Square  London https://t.co/yhuNUi23Uw
6.5283584368667034E17,51.4832476,-0.0100725,South Lift (Cutty Sark) is working. 10/10/2015 13:19:28 GMT
6.5283588561285939E17,51.50116445,-0.11459692,@billiemarten soundcheck. Blissful. DOORS IN 40 GUYS @coppafeelpeople #festifeel @ House of Vans London https://t.co/1s2qtP5nUe
6.5283589084325069E17,51.4864715,-0.0091968,North Lift (Island Gardens) has stopped working. 10/10/2015 13:19:40 GMT
6.5283592170072474E17,51.4559568,-0.3434135,@Greatbigbloke Thanks xxx
6.528359336503296E17,51.6959801,0.24624,Grilling the #steckerlfisch over hot coals  #oktoberfest @ Mustard Seed https://t.co/rw1IhIiXJd
6.5283596598824141E17,51.56642329,-0.10437451,This time last week my view was slightly more exciting than today's... Currently sitting on a train… https://t.co/E0I8CC6CHt
6.5283596958295245E17,51.4832476,-0.0100725,South Lift (Cutty Sark) has stopped working. 10/10/2015 13:19:58 GMT
6.5283597649513267E17,51.59861111,-0.56444444,Temp: 15.1°C  Wind:0.0mph  Pressure: 1018.93hpa Falling  Rain Today 0.0mm.  Forecast: Fine  becoming less settled
6.5283599684589978E17,51.50775246,-0.14370492,Groomsmen all coordinated #fashion #style @ The Mayfair Hotel Stratton Street London https://t.co/zQ1EglQsEX
6.5283601252828365E17,51.5063,-0.1271,1. #WorldMentalHealthDay 2. Geoffrey Howe 3. #RussianGP 4. #facesonfilm13days 5. #nonleagueday  2015/10/10 14:16 BST http://t.co/do7Hdxwcnc
6.5283601431504896E17,51.5063,-0.1271,6. #Ankara 7. Jim Diamond 8. Carlos Sainz 9. Agnes 10. Mix And Mingle  2015/10/10 14:16 BST #trndnl http://t.co/do7Hdxwcnc
6.528360164920279E17,51.4864715,-0.0091968,North Lift (Island Gardens) is working. 10/10/2015 13:20:09 GMT
6.5283602207886131E17,51.5195947,-0.07573739,Fire and Ice and a Holy Horchata from ethosalchemy at #LCW  #Botanical #Bespoke #Cocktail #Vodka #Rum… https://t.co/53azp6EJtI
6.5283603520702054E17,51.4559568,-0.3434135,@night_lord45 Thanks xxxx
6.5283603820590285E17,51.55620366,-0.28010398,Another great game at Wembley last night!! The atmosphere is always… https://t.co/DJsgqtHqoq
6.5283603929646285E17,51.5314353,-0.1260002,@sumly90 jammer dat ik niet kon komen
6.5283609463608525E17,51.4832476,-0.0100725,South Lift (Cutty Sark) is working. 10/10/2015 13:20:28 GMT
6.5283609680439296E17,52.1834351,0.77110329,Love being a Brownie Helper #brownies #girlguiding #discovery #adventure #friendship #fun @ Bradfield… https://t.co/5PmKi2jlmy
6.5283610391810867E17,51.50009654,-0.1281041,Una foto original que nadie se ha hecho nunca. 🇬🇧 #CadepeWorldTrips #CWT #Londres @ Westminster Abbey https://t.co/FtCU2pOLDU
6.5283610407748813E17,51.51453862,-0.165361,An Argentinian Saturday lunch! Bring on the Rib Eye! (@ Casa Malevo) https://t.co/PS2iKR97GK http://t.co/LNpKzVO8aA
6.5283611664771072E17,51.50179674,-0.12171364,#bigben #london #تصويري @ Big Ben & House of Parlament  London Eye & Thames River https://t.co/MHnuylFCxG
6.5283613694809702E17,51.5001524,-0.1262362,We're #hiring! Read about our latest #job opening here: PT Food and Beverage Assistant - Hilton London Canary... - http://t.co/VmvITgq0T0
6.5283614188075008E17,51.4864715,-0.0091968,North Lift (Island Gardens) has stopped working. 10/10/2015 13:20:39 GMT
6.5283616067957965E17,51.4653832,-0.1148274,Drownin in a pit xx part 2 @ O2 Academy Brixton https://t.co/n7IrJVB0XB
6.5283620341117338E17,51.39006944,0.021075,Just posted a photo @ Bromley F.C. https://t.co/JlcSWJlwHq
6.5283621598990746E17,51.50083333,-0.14194444,Nótese mi chamarrón... #Shadow #Love #London #UK #Trip #Express #Holiday #Jolidei #LaVacacion #Casual… https://t.co/8Q50kKai2l
6.5283622109852877E17,51.4832476,-0.0100725,South Lift (Cutty Sark) has stopped working. 10/10/2015 13:20:58 GMT
6.5283622354803917E17,51.51453,-0.12706,Afternoon tea with this one @hollyhoo @ Covent Garden Hotel https://t.co/LtJheXOWLG
6.5283622507044864E17,51.156785,-0.1699865,Want to work at Hilton UK? We're #hiring in #Gatwick! Click for details: http://t.co/qhzrJq9fRy #Hospitality #Job #Jobs
6.5283625032030208E17,51.4559435,-0.3434132,Who fancies me in a Welsh Rugby Shirt then?
6.5283626294094234E17,51.462,-0.084,Spent the morning climbing the old ruins hidden amongst my favourite forest! 🌲🌳🌲🌳   #xperiaz5… https://t.co/jZbigmqdYh
6.5283626617458278E17,51.52268784,-0.16573937,Halfway through a #London #sightseeing tour. #Clients and "me" decided to grab some #fishandchips at… https://t.co/P7Oaot8lPz
6.5283626785667482E17,51.4864715,-0.0091968,North Lift (Island Gardens) is working. 10/10/2015 13:21:09 GMT
6.5283627337204941E17,50.9261055,0.5706766,Can you recommend anyone for this #job? http://t.co/2xU06viQM8 #WestfieldWhiteCity #Hiring #CareerArc
6.528363452038144E17,51.4776377,-0.11637335,@ShamrockSoup @kevinjdavis numbers I quoted (just under 100 per event average) not including Cllr's & staff  we will publish costs very soon
6.5283634665925018E17,51.4832476,-0.0100725,South Lift (Cutty Sark) is working. 10/10/2015 13:21:28 GMT
6.5283637172859699E17,41.0242333,28.9368597,'istifa edecekmisiniz' sorusuna gülerler tabi. siz anca twetter'ı kapatıp yayın yasağı getirirsiniz.!! #TwitterBlockinTurkey
6.5283637315449651E17,51.5222893,-0.14298,Day 155 HS challenge. My twin and I after Bikram sohotyoga 😊 class today was tough as I've been ill… https://t.co/OEk3jRgere
6.5283639324119859E17,51.4864715,-0.0091968,North Lift (Island Gardens) has stopped working. 10/10/2015 13:21:39 GMT
6.5283643825026662E17,51.51347259,-0.13923781,Just posted a photo @ Size? https://t.co/pE79T7i8Rb
6.528364534125527E17,51.4963864,-0.21131964,It's getting bigger and better. Vegfest London Saturday tickets are sold out this year. Queues are… https://t.co/0EjYENVJ87
6.5283645920903578E17,51.4309209,-0.0936496,See our latest #GreaterLondon #job and click to apply: Retail Advisor  16-30 hours  180 High Road  Balham - http://t.co/4QXAo95eQY #Retail
6.5283650778341786E17,51.5355859,-0.10570968,🏡 (@ Business Design Centre in Islington  Greater London) https://t.co/Vcyo3B67qk
6.5283652084452557E17,51.4864715,-0.0091968,North Lift (Island Gardens) is working. 10/10/2015 13:22:10 GMT
6.5283653632135987E17,51.5063,-0.1271,Trend Alert: 'Mix And Mingle'. More trends at http://t.co/do7Hdxwcnc #trndnl http://t.co/DKateUUYQj
6.528365389931479E17,51.5063,-0.1271,Trend Alert: 'Nico'. More trends at http://t.co/do7Hdxwcnc #trndnl http://t.co/W6noiD7QH5
6.528365418202071E17,51.5629719,-0.3753279,@roomslanka thank you please share could be an xmas No1 http://t.co/0vjCCSUxPq ya me x
6.5283655227225293E17,51.4333,-0.216667,Saturday treats🍰🍪🎂🍩 #london #treats #coffee #weekend #wimbledon @ Wimbledon  United Kingdom https://t.co/MgGrTlf1q5
6.5283656853782938E17,51.5072,-0.1275,Triyin some colors. Availables #london #londontattoo #traditional #traditionaltattoo #flash… https://t.co/zxfqcsFzxO
6.5283658674110054E17,51.44096897,-0.15036862,Silky and milky #vacherin season is upon us #rawmilk #londoncheesemongers @ Balham South London https://t.co/wDCUhe3u6O
6.5283659267617178E17,51.417206,-0.213106,@jamesowenfender shows he can play two handed racquetball too #worldsquashday http://t.co/n6wWb7BJFa
6.5283660476833792E17,51.65241447,-0.21959646,The Arkley has a new menu!! The smoked haddock & horseradish fish cakes with poached egg & I am told… https://t.co/GntpsjHsvZ
6.5283660726390784E17,51.51569838,-0.13862553,yeah @ Lush Oxford Street https://t.co/dePnCushXo
6.5283662321484186E17,51.5767,0.0862,Game of got-your-nose with the nephew just got flipped #babyuddin #rayan #gotyournose @ Newbury Park … https://t.co/tng6IfXA6f
6.5283663102048256E17,51.35053056,-0.12393951,Ladies cross country (@ Roundshaw Common) https://t.co/0TQGyqQLrA
6.5283663227459584E17,51.51310492,-0.13989751,I'm at @Dishoom Carnaby in London https://t.co/scGn0s0sE6
6.5283663738743194E17,51.49290864,-0.2546238,Garden Children by Rhian Sheehan is #nowplaying in Hare & Tortoise.  Download it now at http://t.co/vZDHp3Pfup
6.5283664120840602E17,51.55314165,-0.44445624,Just walked from Uxbridge to here  still going. (@ North Hillingdon) https://t.co/kBjB41tK8C
6.5283664484488397E17,51.4864715,-0.0091968,North Lift (Island Gardens) has stopped working. 10/10/2015 13:22:39 GMT
6.5283664486573261E17,51.4654277,-0.2547461,#LONDON  GREATER LONDON #Engineering #Job: Senior Transport Economist - London at CH2M http://t.co/NYTZT9bxZZ #Jobs #Hiring #CareerArc
6.5283667123545702E17,51.5338,-0.2026,People often as me: "Keith how do you carb load pre-race?" Well  since I've never done it before  I… https://t.co/iZYMHUv8B1
6.5283670283522867E17,51.508611,-0.163611,Reading at Hyde Park bahahahaha (kita saja yang tau tu kak) @ Hyde Park … https://t.co/LebwZNciPg
6.5283670657245594E17,51.47171,-0.468103,excited to be back :) (@ London @HeathrowAirport (LHR) in Hounslow  London) https://t.co/n4ZcuZNyjq
6.5283672382363648E17,51.5443945,-0.43837161,More common #sports injuries and #treatments  #healthornothing #weightloss #diettips #diet #toning… https://t.co/ZzenseF0rB
6.5283672431856845E17,51.4832476,-0.0100725,South Lift (Cutty Sark) has stopped working. 10/10/2015 13:22:58 GMT
6.5283672548036608E17,51.5096817,-0.1379546,Cocktail number 1  Gaucho 🍸 @ Gaucho Piccadilly https://t.co/DnHAXxYwFr
6.5283676649232794E17,51.51201461,-0.12314293,Still not lost! (@ Covent Garden in London  Greater London w/ @somarcsaid) https://t.co/xVjH5qoNzd
6.5283677054400922E17,51.4864715,-0.0091968,North Lift (Island Gardens) is working. 10/10/2015 13:23:09 GMT
6.5283677304802509E17,51.54250886,-0.20881467,Apperently my house is a motel. #straydogs #findVicSebDennis @ The Avenue Kilburn https://t.co/PIanMbJgvO
6.5283680104080998E17,51.41970566,0.25836759,Kate's going to love her birthday presents 🙋🏻😁🎁🎉🎈
6.5283682495250022E17,51.55164276,-0.07503666,I'm at @HighWaterLondon in London https://t.co/HEXYS1bUX6
6.5283683313980211E17,51.51876515,-0.20736824,Saturday brunch.#NasiLemak #MalaysiaTrulyAsia @ Makan Cafe https://t.co/8J1rWh2w8g
6.5283683323203584E17,51.47137783,-0.47608903,At Heathrow airport!! Been an epic journey!! @ London Heathrow Airport Terminal 5 https://t.co/ruMKGkfDuq
6.5283685040771072E17,51.4832476,-0.0100725,South Lift (Cutty Sark) is working. 10/10/2015 13:23:28 GMT
6.5283689576914125E17,51.5124032,-0.11495135,#lvseries3 @ Louis Vuitton Series 3 Exhibition London https://t.co/f1yVVAPKKJ
6.5283691835968307E17,51.52838624,-0.07564884,Having grey hair is a full time job 👵🏽🔫  @erikabowes one of our stunning clients #greyhair by… https://t.co/Sd7lRExyGS
6.5283692224768E17,51.5001524,-0.1262362,See our latest #London #job and click to apply: Data Integration Consultant - http://t.co/1uhq8lAKKM #ExpediaJobs #BusinessMgmt #Hiring
6.5283693385344614E17,51.45679031,-0.30298849,Saturday flat out with @s0urgrapes and melina_tattoo at latinangeltattoo #roses #pocketwatch #crow… https://t.co/xStI6QCkSV
6.5283694063557427E17,51.49267893,-0.14880955,Not even got to the airport yet 🍻🍹🍷 @ Victoria Coach Station https://t.co/0qLidSICKm
6.5283695055935488E17,51.48812356,-0.16503465,I'm at London Borough of Chelsea in Chelsea  Greater London w/ @14shazza https://t.co/utbeifSuMC
6.52836973871104E17,51.58112365,-0.23690888,Love this #heron #BurgessPark @ Burgess Park https://t.co/fnlciwKSr1
6.5283697590973235E17,51.4832476,-0.0100725,South Lift (Cutty Sark) has stopped working. 10/10/2015 13:23:58 GMT
6.5283701225743565E17,51.50083333,-0.12194444,#eyes #eyelondon #londoneye #تصويري @ Westminster Bridge https://t.co/EbvEcHF1NF
6.5283702270138368E17,51.54174968,-0.14595482,Just posted a photo @ Camden Market https://t.co/0WCwHnDWSV
6.5283702810365133E17,51.60909624,-0.22254104,Pamiętajmy  że kiedyś każdy jeździł Lką
6.528370474519593E17,51.50997112,-0.12284517,Kinky Boots (@ Adelphi Theatre - @rutheatres in London) https://t.co/ts89TlOajn
6.5283706047945114E17,51.69052194,-0.41849042,In the Great Hall with @benjiheath89 at @wbtourlondon such an incredible set and takes you right into… https://t.co/m69y9uXe2V
6.5283707138883584E17,51.53422809,-0.12406508,Show 1 of 4 this weekend: @InTheHeightsLDN. #ShowBIZ (@ King's Cross Theatre w/ @lvdrake) https://t.co/9ru66dFJTV
6.5283707479462707E17,51.51361111,-0.11333333,On the bus......passing Somerset house. Most people know this brand because of #kanyewest @ Royal… https://t.co/TMeJ4CqwXU
6.5283709811058278E17,51.47468502,-0.19216742,How to spend a weekend as a good student :P @ Wandsworth Bridge Road  Fulham https://t.co/J6qdnT76Lq
6.5283710110967398E17,51.4832476,-0.0100725,South Lift (Cutty Sark) is working. 10/10/2015 13:24:28 GMT
6.5283710576113254E17,51.51010967,-0.12292545,Front row seats  and ready for the show to get started  #kinkyboots… https://t.co/dcpYJvXLw4
6.5283713705055027E17,51.5124032,-0.11495135,😍 @ Louis Vuitton Series 3 Exhibition London https://t.co/d6YWcm2Y4n
6.5283714683175322E17,51.4864715,-0.0091968,North Lift (Island Gardens) has stopped working. 10/10/2015 13:24:39 GMT
6.5283715462059213E17,51.50798789,-0.12804866,Africa on the Square. (@ Trafalgar Square in London  Greater London  London) https://t.co/lmPhFPSCIB http://t.co/jNG2xPqX9O
6.5283715996414362E17,51.0333,0.416667,Day out in jessica the MG #midget #countryside @ Ticehurst https://t.co/fbrB452nTG
6.5283716483361997E17,51.5072,-0.1275,Flowers make the soul smile  can you hear mine? Flores hacen sonreír al alma  puedes oír el… https://t.co/nky2ACVAzs
6.5283716492587418E17,51.4654277,-0.2547461,#Construction #Job in #LONDON  GREATER LONDON: Commerical Manager - London  UK at CH2M http://t.co/BZXA5tGzRp http://t.co/ywLSAVsoWw
6.528372131100713E17,51.55485069,-0.10848736,Furthest north London I've been @ Emirates Stadium https://t.co/nqNYQ5MgSi
6.5283721524506214E17,51.50518452,-0.15012839,Qapco meeting in London @ Metropolitan by COMO  London https://t.co/0miLrVClQb
6.5283722819711795E17,51.4832476,-0.0100725,South Lift (Cutty Sark) has stopped working. 10/10/2015 13:24:58 GMT
6.5283724075893146E17,51.49575678,-0.23833952,#carterssteamfair #ravenscourtpark @ Carters Steam Fair Ravenscourt Park https://t.co/fZddS1eksk
6.5283725016684544E17,51.51121554,-0.08356172,#skygarden @ The Sky Garden https://t.co/jPGKO7v45C
6.5283727315164365E17,51.4864715,-0.0091968,North Lift (Island Gardens) is working. 10/10/2015 13:25:09 GMT
6.5283729443354624E17,51.74618752,-0.47330077,Having lunch with friends (@ Hemel Hempstead in Hemel Hempstead  Hertfordshire) https://t.co/VAs2RHy7Ka
6.5283735327963546E17,51.4832476,-0.0100725,South Lift (Cutty Sark) is working. 10/10/2015 13:25:28 GMT
6.5283736404206387E17,51.58112365,-0.23690888,#squirrel in #camouflage mode ^_^ #BurgessPark @ Burgess Park https://t.co/zhEgkkKxwo
6.5283739014756352E17,51.49868359,-0.16248515,What amazing pastries 😘😘👍👍🍰🍰🍰🍰🍰🍰 @anjavanzyl inezduplessis… https://t.co/5KCsSN1BNw
6.5283739828451328E17,51.4864715,-0.0091968,North Lift (Island Gardens) has stopped working. 10/10/2015 13:25:39 GMT
6.5283740020113408E17,51.5088844,-0.1322833,And we're off! My first #LFF 2015 screening in T-5 minutes :D Nine days of film fun starts here... @… https://t.co/KwDkoimqUf
6.5283740195873997E17,51.4653832,-0.1148274,shame about the awful crowd but peace4everever were amazing last night - definitely one of the best… https://t.co/vseaKbd0ko
6.5283743137334067E17,51.508611,-0.163611,نفتر بالبحييره @ Hyde Park  London https://t.co/Yry68pvRIe
6.5283744648962458E17,51.521059,-0.0726521,Tonight 🎵 @ The Big Chill Bar https://t.co/jMDP1chbyL
6.5283747894513664E17,51.4832476,-0.0100725,South Lift (Cutty Sark) has stopped working. 10/10/2015 13:25:58 GMT
6.5283748225430323E17,51.5001524,-0.1262362,Want to work at Oracle? We're #hiring in #London! Click for details: http://t.co/efTRyjjQCT #Sales #Job #Jobs #CareerArc
6.5283749389786317E17,51.36073202,0.08816925,Love these brows !! Hair stroke brows in the shade Paris ..this colour… https://t.co/tw23ABIkI9
6.5283749573917082E17,51.562149,0.0064,Life is like a dream  live it. @ Victoria Park https://t.co/MHwld1OQ42
6.5283751079251149E17,51.489,-0.054009,Bermondsey Beer Mile. Stop #1#london #beer - Drinking a Session IPA at @fourpurebrewing - http://t.co/4AvVGTahDz #photo
6.5283752577875968E17,51.4864715,-0.0091968,North Lift (Island Gardens) is working. 10/10/2015 13:26:09 GMT
6.5283753404570829E17,51.50748924,-0.02256793,Going to the meeting @ Cineworld West India Quay https://t.co/mmmURlJ3t1
6.5283754905717965E17,51.4663773,-0.1514175,Name that tune  what made you think WOW I love it  it might get some play at #SpitVocool tomorrow.… https://t.co/bPW8GYF4ZA
6.5283755838527898E17,51.5708605,-0.56331924,🙋🏼💄 @ Gerrards Cross  London https://t.co/30YK4y9Rov
6.5283757085915546E17,51.5072,-0.1275,Home made blackberries wine. Yes  wine! Exactly like the one which sometimes is made out of… https://t.co/WB46gl5LWs
6.5283758790888243E17,51.43022674,0.5825758,#pumpkinpickingselfie #belunclefarm #pyopumpkins @stuartmerrett84 @ PYO Pumpkins https://t.co/vGJKnvu0qf
6.5283759445628109E17,51.48700067,-0.38124237,#designer #gold #leaf #24carat #stenciling #piping #ruffled # vintage #comtemporary #mix #mint #green… https://t.co/2RQ4f2Rj2p
6.5283759468265882E17,51.4106827,-0.3035609,I love you @marksandspencer but think this line probably needs a rename no? @ Marks and Spencer -… https://t.co/fhr51jqyNN
6.5283761934517862E17,51.50179674,-0.12171364,Supporting the boys everywhere I go! Thanks brent9williams  for the T-shirt. @jsomethingmusic… https://t.co/COBPsB0MyS
6.528376326496256E17,51.50907318,-0.13954833,#aiweiwei #royalacademyofarts #tree #art #RA #london @ Royal Academy of Arts https://t.co/H3kAhQehaS
6.5283764505219482E17,51.51228222,-0.12311616,En attendant NYC #shakeshack @ Covent Garden  London  UK https://t.co/M87sNDCH8z
6.5283764952332288E17,51.4864715,-0.0091968,North Lift (Island Gardens) has stopped working. 10/10/2015 13:26:39 GMT
6.5283766552461312E17,51.50454331,-0.17440662,Entrailles en technicolor par Selgascano @serpentineuk @ Serpentine Pavillion https://t.co/EGfW4ZmHa8
6.5283768558594867E17,51.75051402,-0.32743871,I'm at St Albans City Railway Station (SAC) - @nationalrailenq in St Albans  Hertfordshire https://t.co/PzYOSipR0q
6.5283770810922189E17,51.50790344,0.02622906,#indiafashionweeklondon @ National Asian Wedding Exhibition @ ExCel https://t.co/dCu21zc9II
6.5283772264250982E17,51.5350983,-0.1036817,Eat the rude  if you know what I mean.  _______  #vsco #vscocam #vscophile #vscophotos #vscolondon… https://t.co/9wO7Jj9XFW
6.5283772354005402E17,51.5145035,-0.2006565,Saturday morning brunch catch up with the girls 🍳 #daylesfordorganic #nottinghill #weekend #brunch… https://t.co/KlUsfyM2KF
6.5283772547375514E17,51.5087167,-0.12810758,👼  #leonardodavinci #verginedellerocce #nationalgallery #london #england… https://t.co/dlS5IQHAKD
6.5283775482970112E17,51.50561185,-0.09043019,Who's lookin' at you? Yum. #boroughmarket @ Borough Market https://t.co/LmKUQIwHwh
6.528377608609833E17,51.5001524,-0.1262362,This #IT #job might be a great fit for you: Website Testers / Admin - Luxury Fashion - Temp - http://t.co/56pTgMXuej #London #Hiring
6.5283776389349786E17,51.48587822,-0.11335493,Prizes are off... For the #londonginexperience beefeatergin #homeofgin get them answers in!… https://t.co/xCm7w1ivWn
6.5283776502186803E17,51.51485049,-0.20382421,Sake day #london with Flavia @ Portobello Road Market https://t.co/fFOw8CYkeZ
6.5283777352792064E17,51.35687239,-0.04098857,Isn't she lovely 👰🏾 @ Addington Palace https://t.co/oAio6Js92A
6.5283778650089062E17,51.4259421,0.1092224,So excited for tonight #team #swimfast @BexleySC
6.5283779001140429E17,51.5063,-0.1271,Trend Alert: #AsOne. More trends at http://t.co/do7Hdxwcnc #trndnl http://t.co/dioGX1Is0b
6.5283781436366848E17,51.51317,-0.15888,Just posted a photo @ Marble Arch https://t.co/Cm1lxSg62y
6.5283783538967347E17,51.5124032,-0.11495135,#LV #series3 exhibition @ Louis Vuitton Series 3 Exhibition London https://t.co/jlK847oH4q
6.5283783612792832E17,51.484684,-0.1756292,Three Musketeers reunited!  And it feels so hungover sollimonster… https://t.co/tZM88emSNC
6.528378422388695E17,51.5673065,-0.1384578,absolutely  positively "the NORTH". @ Whittington Cat https://t.co/wP6BziB8Hh
6.5283785604242637E17,51.4832476,-0.0100725,South Lift (Cutty Sark) is working. 10/10/2015 13:27:28 GMT
