id,latitude,longitude,text
6.5091736971227546E17,51.47002,-0.454296,Michael Clifford Sighting: Longford  United Kingdom/ London Heathrow Airport http://t.co/B39rJ8piAh @Michael5SOS @5SOS_Updates @5SOS_Update
6.5091747425528627E17,51.50538977,-0.10739665,Metallica Vs. Motley Crue Feud News To Vince Neil Recap http://t.co/8dcLHqA2mv http://t.co/2HI4EYUsoS
6.5091760749996032E17,51.5063,-0.1271,Trend Alert: #5pbagcharge. More trends at http://t.co/do7Hdxwcnc #trndnl http://t.co/YjgO9dDikr
6.5091777243257651E17,51.50823749,-0.05933399,#london #loves_bodyart #londontattooconvention #uk #francescopht #fraffetto #tattoo #tattoos #ink… https://t.co/BsJ8HBRypS
6.5091780335296512E17,51.47002,-0.454296,Ashton Irwin Sighting: Longford  United Kingdom/ London Heathrow Airport http://t.co/JlrTSavy5M @Ashton5SOS @5SOS_Updates @5SOS_Update
6.5091786516037222E17,51.47449679,-0.18310168,I'm at Harris + Hoole - @hhimperialwharf in Fulham  Greater London https://t.co/Ex7aauGSkh
6.5091786839413965E17,51.4714943,0.1098453,Bitter sweet malady
6.5091794389989786E17,51.44197393,-0.08955078,StockMarketWire FLASH: GrandVision to acquire For Eyes http://t.co/j4GxrUXDGc http://t.co/GJtVCdlZFY
6.5091794559854182E17,51.44197393,-0.08955078,StockMarketWire FLASH: Feedback JV to develop prostate cancer product http://t.co/oj4tkii5CE http://t.co/GJtVCdlZFY
6.5091794690304E17,51.44197393,-0.08955078,StockMarketWire FLASH: Totally Plc names Tony Bourne as non-exec director http://t.co/9pfHA8HjqB http://t.co/GJtVCdlZFY
6.5091794845908582E17,51.44197393,-0.08955078,StockMarketWire FLASH: BMR sees potential market for Waelz Kiln Slag http://t.co/QMNIol4prU http://t.co/GJtVCdlZFY
6.5091795002778829E17,51.44197393,-0.08955078,StockMarketWire FLASH: UK Oil & Gas receives conceptual oil development studies http://t.co/IpQQp8JmPg http://t.co/GJtVCdlZFY
6.509179513825239E17,51.44197393,-0.08955078,StockMarketWire FLASH: Waterman Group improves FY pretax profit http://t.co/jDDBwVc36i http://t.co/GJtVCdlZFY
6.5091795152528998E17,51.5370814,-0.3116349,Gentle one to start the week. 42 minutes. I just finished cycling 14.56 km in 43m:29s with #Endomondo #endorphins http://t.co/hGzmaauzco
6.5091795275406131E17,51.44197393,-0.08955078,StockMarketWire FLASH: ADAM to invest a further $3m in Adamas's GCCF http://t.co/6qQtHktmQO http://t.co/GJtVCdlZFY
6.5091795402072883E17,51.44197393,-0.08955078,StockMarketWire FLASH: Ryanair Holdings improves September traffic figures http://t.co/VvTKH2TkTX http://t.co/GJtVCdlZFY
6.5091795559361331E17,51.44197393,-0.08955078,StockMarketWire FLASH: Alexander placing to raise Â£420 000 http://t.co/PgFReRtCOy http://t.co/GJtVCdlZFY
6.5091795685609882E17,51.44197393,-0.08955078,StockMarketWire FLASH: Rolls-Royce continues Marine transformation http://t.co/GpxjK71EIB http://t.co/GJtVCdlZFY
6.5091798568357478E17,51.44197393,-0.08955078,StockMarketWire FLASH: Allied Minds unit raises $33.6m http://t.co/klxNnLoQAq http://t.co/GJtVCdlZFY
6.5091798749127475E17,51.44197393,-0.08955078,StockMarketWire FLASH: OPG Power Ventures facilitates Chennai sales contracts http://t.co/XawPAz1Jf6 http://t.co/GJtVCdlZFY
6.5091798912283443E17,51.44197393,-0.08955078,StockMarketWire FLASH: Ferrexpo pellet production up 5.1% http://t.co/C0wJ7LersJ http://t.co/GJtVCdlZFY
6.5091799099349402E17,51.44197393,-0.08955078,StockMarketWire FLASH: Somero director Ronald Maskalunas steps down http://t.co/boWth0Nwxj http://t.co/GJtVCdlZFY
6.5091799283903283E17,51.44197393,-0.08955078,StockMarketWire FLASH: Ithaca Energ capex reduced to $120m http://t.co/jlgfxGP7IM http://t.co/GJtVCdlZFY
6.5091799392127795E17,51.6132507,-0.1765829,Motivation Monday💪🏼💦 @ London Studio Centre https://t.co/Mle3gTzDgG
6.5091799482711654E17,51.44197393,-0.08955078,StockMarketWire FLASH: Playtech updates on acquisition of Ava Trade Ltd http://t.co/XR15DCYxoV http://t.co/GJtVCdlZFY
6.5091799687397376E17,51.44197393,-0.08955078,StockMarketWire FLASH: Aminex update on Kiliwani North http://t.co/iyKqZ7SBKD http://t.co/GJtVCdlZFY
6.509179988830167E17,51.44197393,-0.08955078,StockMarketWire FLASH: OPG Power Ventures updates on Gujarat Transmission line http://t.co/wcjcRbZUGt http://t.co/GJtVCdlZFY
6.5091800069494374E17,51.44197393,-0.08955078,StockMarketWire FLASH: Elektron unit launches new product http://t.co/Hz6rj2g4LE http://t.co/GJtVCdlZFY
6.509180026788864E17,51.44197393,-0.08955078,StockMarketWire FLASH: San Leon updates on Rawicz-15 development well http://t.co/IkaCLkFRi8 http://t.co/GJtVCdlZFY
6.5091805828708762E17,51.55485069,-0.10848736,#arsenal @ Emirates Stadium https://t.co/RFngD5pQ3I
6.5091809291093197E17,51.55571972,-0.10813798,3-0 to the #Arsenal over ManUnited at the #Emirates #gunnersaurus… https://t.co/0tjjrPWgE7
6.5091810328766054E17,51.74993881,-0.33674316,A1(M) northbound between J7 and J8 | Northbound | Congestion: On the A1(M) northbound between… http://t.co/4yuNKfQmfY #stalbans #harpenden
6.5091810407616922E17,51.44197393,-0.08955078,StockMarketWire FLASH: fastjet passenger figures jump http://t.co/EBLhDTWvDp http://t.co/GJtVCdlZFY
6.5091810552320819E17,51.44197393,-0.08955078,StockMarketWire FLASH: MTW acquires pension admin business of Lindley Group http://t.co/Hu7nbL0f5S http://t.co/GJtVCdlZFY
6.5091810715474739E17,51.44197393,-0.08955078,StockMarketWire FLASH: cloudBuy appoints Nomad http://t.co/JhVjPvFdif http://t.co/GJtVCdlZFY
6.5091810851796173E17,51.44197393,-0.08955078,StockMarketWire FLASH: MX Oil gives Mexico update http://t.co/Zam9m6vowb http://t.co/GJtVCdlZFY
6.5091811003206451E17,51.44197393,-0.08955078,StockMarketWire FLASH: Nasstar acquires VESK Group http://t.co/UtN7kFwP3b http://t.co/GJtVCdlZFY
6.5091811124842086E17,51.44197393,-0.08955078,StockMarketWire FLASH: eServGlobal agrees loan of up to Â£5m http://t.co/JXhFWtpwJ0 http://t.co/GJtVCdlZFY
6.5091811261590323E17,51.44197393,-0.08955078,StockMarketWire FLASH: Solo Oil gives Kiliwani North development update http://t.co/jXxNBjR0xL http://t.co/GJtVCd4oOq
6.5091811459546317E17,51.44197393,-0.08955078,StockMarketWire FLASH: Wizz Air issues September 2015 traffic statistics http://t.co/nJk8pO5xz4 http://t.co/GJtVCdlZFY
6.5091811584956006E17,51.44197393,-0.08955078,StockMarketWire FLASH: Belvoir to acquire Goodchilds http://t.co/B84iRXq9gP http://t.co/GJtVCdlZFY
6.5091811709109862E17,51.44197393,-0.08955078,StockMarketWire FLASH: KEFI Minerals progress at Jibal Qutman http://t.co/6tzzeFw4jx http://t.co/GJtVCdlZFY
6.5091818021958861E17,51.5374413,-0.0609672,Gotta train this morning after an amazin roast yesterday nice one Motha Clucka @motherclucker… https://t.co/B6OOG0lZj4
6.5091823154946048E17,51.44197393,-0.08955078,StockMarketWire FLASH: Red Rock Resources eliminates net overheads http://t.co/oXc5IciZXp http://t.co/GJtVCdlZFY
6.5091823322294272E17,51.44197393,-0.08955078,StockMarketWire FLASH: Trinity Mirror sees FY performance in line with views http://t.co/0YiBGlft5k http://t.co/GJtVCdlZFY
6.5091823497618227E17,51.44197393,-0.08955078,StockMarketWire FLASH: Hargreaves' markets remain weak http://t.co/OziMqd5UJa http://t.co/GJtVCdlZFY
6.5091823674620314E17,51.44197393,-0.08955078,StockMarketWire FLASH: AFC's KORE system delivers power http://t.co/nXg6n45jpw http://t.co/GJtVCdlZFY
6.5091823854558003E17,51.44197393,-0.08955078,StockMarketWire FLASH: XCH confirms approaches by Capita and Apollo Global http://t.co/tI8ixoYtvG http://t.co/GJtVCdlZFY
6.5091824020648346E17,51.44197393,-0.08955078,StockMarketWire FLASH: Hardide on track http://t.co/EUTn2y4etH http://t.co/GJtVCdlZFY
6.5091824185080218E17,51.44197393,-0.08955078,StockMarketWire FLASH: CAML has record output in September http://t.co/dVBD72HSCW http://t.co/GJtVCd4oOq
6.5091824346543309E17,51.44197393,-0.08955078,StockMarketWire FLASH: LGO raises Â£1m for further Goudron Investment http://t.co/YWqIenri9c http://t.co/GJtVCdlZFY
6.5091824513061274E17,51.44197393,-0.08955078,StockMarketWire FLASH: Charles Taylor unit to sell stake in Bestpark http://t.co/nfofcNjeMX http://t.co/GJtVCdlZFY
6.5091824693838234E17,51.44197393,-0.08955078,StockMarketWire FLASH: Ironveld funding update http://t.co/o7TdzuV6li http://t.co/GJtVCdlZFY
6.5091834664547942E17,51.59861111,-0.56444444,Temp: 13.1°C  Wind:0.0mph  Pressure: 1004.54hpa Falling  Rain Today 0.4mm.  Forecast: Occasional precipitation  worsening
6.509183726207017E17,51.44197393,-0.08955078,StockMarketWire FLASH: Bioventix profits up http://t.co/dchgRxHbZz http://t.co/GJtVCdlZFY
6.509183742648361E17,51.5063,-0.1271,@biraofficial the 1st mention of #5pbagcharge appears on your TL. Now is Trending Topic in United Kingdom! #trndnl
6.5091838297219891E17,51.5063,-0.1271,1. #mondaymotivation 2. #worldteachersday 3. #plasticbags 4. Shoppers in England 5. Lord Adonis  2015/10/5 07:18 BST http://t.co/do7Hdxwcnc
6.5091838492676915E17,51.5063,-0.1271,6. #5pbagcharge 7. #WakeUpMusicVideo 8. AstraZeneca 9. Orlando Pirates 10. Dan Poulter  2015/10/5 07:18 BST #trndnl http://t.co/do7Hdxwcnc
6.5091842273837466E17,51.5072,-0.1275,Forgot my running shoes so having an early desk start instead of the gym 😢😴 #monday #mondays… https://t.co/HtSCD9eLbm
6.5091845856192102E17,51.5063,-0.1271,113 users and 123 tweets (72 RTs) in 6 days made #5pbagcharge a Trending Topic in United Kingdom. #trndnl
6.5091846018517811E17,51.5063,-0.1271,128 712 people could have seen #5pbagcharge since its 1st mention until it became a Trending Topic. #trndnl
6.5091846188380979E17,51.5063,-0.1271,#Top3Apps for #5pbagcharge  Twitter for iPhone 47% Twitter for Android 22% Twitter Web Client 10%
6.5091846351543091E17,51.5063,-0.1271,The tweet with the most impact of the #5pbagcharge Trend  was published by @nataliefee: http://t.co/po3wcAbeAv (19 RTs) #trndnl
6.509185537474601E17,51.55665377,-0.27963254,J-E-T-S JETS JETS #JETS #Dolphins #NFL #LONDON @ Wembley Stadium https://t.co/RDLKUKFWmw
6.5091861054257152E17,51.52986,-0.07692,Ready for big Ben 😁 (at Central Hoxton Shoreditch Studios) [pic] — https://t.co/7KYFeWzlD1
6.5091863337638298E17,51.5001524,-0.1262362,Join the Hilton UK team! See our latest #Hospitality #job opening here: http://t.co/HWddxfVOy6 #London #Hiring
6.5091872836478157E17,51.74972626,-0.34017639,M25 clockwise between J9 and J10 | Clockwise | Accident: On the M25 clockwise between… http://t.co/L8jXXsENuO #stalbans #harpenden
6.5091875761177805E17,51.5309312,-0.1316816,@jruddy99 New Birmingham line could link into Crossrail and go through central London to Stratford. "HS2" has no need to come to Euston.
6.5091885662653645E17,51.5063,-0.1271,Trend Alert: 'Dan Poulter'. More trends at http://t.co/do7Hdxwcnc #trndnl http://t.co/nIPMzQ3BKj
6.5091887738848051E17,51.3998461,-0.2999804,"@HistoricalPics: The Pink Ladies from Grease. http://t.co/iqnaWfWHs2" loved Rizzo!
6.5091893925449728E17,51.3699171,-0.49533931,@Rosyr90Raguso Sorry missed your Tweet last night  good morning enjoy your day -:)
6.5091899562591027E17,51.53236712,-0.12353349,🏫 @ London King's Cross Station https://t.co/BjwNq76bNn
6.5091905793650278E17,51.4779258,-0.26430055,Good morning! (@ Heleny Home) https://t.co/al83x3v8do http://t.co/z5ymV6XXZG
6.5091923305291366E17,51.37595804,-0.0926016,I'm at East Croydon Railway Station (ECR) - @nationalrailenq in Croydon  Greater London https://t.co/aO22aT9bVz
6.5091927598988902E17,51.50823749,-0.05933399,#london #loves_bodyart #londontattooconvention #uk #francescopht #fraffetto #tattoo #tattoos #ink… https://t.co/bd4GfyWp5z
6.5091937786528154E17,51.532006,-0.177331,#abbeyroad #LONDON #londres @ Abbey Road  London https://t.co/ys7q6yVwMD
6.5091945372363981E17,51.49960344,-0.16305269,Float On by The Floaters is #nowplaying in Harrods  London.
6.5091948750873805E17,50.77294769,0.15338082,🎒👟👣 @ Seven Sisters Country Park https://t.co/tHjVJWGYUG
6.5091966877401088E17,51.87932353,-0.37613604,Labs rīts (@ London Luton Airport (LTN) - @ldnlutonairport in Luton  Bedfordshire) https://t.co/tw6AvGEiDO
6.5091976556172493E17,51.58239497,-0.09958147,Well dark t'smarnin
6.509198403000279E17,51.64318864,-0.4324542,Get Down by James Arthur is #nowplaying in Anytime Fitness Demo.  Download it now at http://t.co/WZytR0tJYh
6.5091987498684006E17,51.5063,-0.1271,@bendean1979 the 1st mention of 'Dan Poulter' appears on your TL. Now is Trending Topic in United Kingdom! #trndnl
6.5091987924835942E17,51.51722219,-0.09800792,Another week ..... (at @LAFitnessUk_hq in London  Greater London) https://t.co/KuOtWFYMBV
6.509198835977216E17,51.5309312,-0.1316816,@jruddy99 Euston is already full to bursting. Bringing more trains there will cause Tube chaos. Better to stop "HS2" at Old Oak Common then.
6.5091993338829619E17,51.5063,-0.1271,600 users and 611 tweets (563 RTs) in 1 week made 'Dan Poulter' a Trending Topic in United Kingdom. #trndnl
6.5091993499048346E17,51.5063,-0.1271,441 706 people could have seen 'Dan Poulter' since its 1st mention until it became a Trending Topic. #trndnl
6.5091993651721421E17,51.5063,-0.1271,#Top3Apps for 'Dan Poulter'  Twitter for iPhone 39% Twitter Web Client 13% Twitter for Android 13%
6.5091993809432986E17,51.5063,-0.1271,The tweet with the most impact of the 'Dan Poulter' Trend  was published by @cpeedell: http://t.co/VO8GFnUcwg (111 RTs) #trndnl
6.5091994022078464E17,51.5063,-0.1271,2 verified accounts helped to turn 'Dan Poulter' into a Trending Topic. These accounts were: @commentisfree & @BBCHughPym — #trndnl
6.5092004449542144E17,51.47080433,-0.4572091,Good morning Heathrow. #mileburn2015 @ Heathrow Airport https://t.co/iWDeigFZ0m
6.5092013311689114E17,51.56121805,-0.27902673,this photo reminds me of making a scene in novotel hotel just to have a photo with this cute guy… https://t.co/jLgmBIv7Hi
6.5092020139604787E17,51.4725638,-0.486871,So ends an awesome two months...
6.5092023099106918E17,51.5072,-0.1275,Ik wil snel terug naar #london .. #heimwee #londonlover #underground #metro #tube… https://t.co/yivHWSDv8S
6.5092023626753638E17,51.711487,-0.324236,Congestion (Moderate delay) M25 anti-clockwise between J22 and J21A On the M25 anti-clockwise between j... http://t.co/yrHnVsrHEH #beepbeep
6.5092036568261427E17,51.5063,-0.1271,On average  Worldwide's Trends for last Sunday 4 had 11 characters long: http://t.co/gKfaQstYPD #trndnl
6.5092038113445069E17,51.5063,-0.1271,'Broner' appeared on Sunday 4 at the 20th place in the Top20 of United Kingdom's Trends: http://t.co/fBbEDBbEin #trndnl
6.5092040132585472E17,51.5072,-0.1275,#london #vsco #vscocam @ London  United Kingdom https://t.co/t00Jqowlw0
6.5092041637930189E17,51.49355289,-0.09857561,grand mixxer b2b finn at boxed @ Corsica Studios https://t.co/Knz3p4y8Mo
6.5092053249441382E17,51.47312371,-0.48910618,I'm at Gate A1 in Hounslow https://t.co/ZqdUpkE6Rq
6.5092064881073766E17,51.5072,-0.1275,#london #vsco #vscocam @ London  United Kingdom https://t.co/K2Z23A44I4
6.5092067949220659E17,51.532222,-0.156667,Date night @ Regent's Park https://t.co/V4Ev52uhIR
6.5092069991425229E17,51.49960344,-0.16305269,Corcovado by Karen Souza is #nowplaying in Harrods  London.  Download it now at http://t.co/4UK6tWpfl2
6.5092070178911027E17,51.49960344,-0.16305269,Buffalo Stance by Neneh Cherry is #nowplaying in Harrods  London.
6.5092077315936256E17,51.55675,-0.27931667,J e t jets jets jets!!!!!! #nyjets #newyorkjets #newyorkjetsuk #nfl #nfluk #nflwembley #jets #jetsuk… https://t.co/k3e13PNUuV
6.5092085214234214E17,51.33222222,-0.55777778,Temp 12.4°C Wind 9mph Press 1001.2hpa Falling slowly Cloud 289 ft Rain 0.5mm Humidity 96% #Woking #UKWeather
6.5092088820078592E17,51.87472222,0.98694444,Wind 2.2 mph SSE Barometer 1007.0 mb Falling  Temperature 14.8 .C  Rain today 0.0 mm  Humidity 73% @ 07:30:07.#ukweather.#weather
6.5092099679126323E17,51.41192,-0.2221276,@KerDunkedunk @TeddyBearScouts @BooBooBearGreen @reddy1408 @BearBerkeley @ToddyFur me too!
6.509210049658839E17,51.4669939,-1.1853677,Quintiles #Pharmaceutical #Job: Telemarketing Service Agents - Reading  Berkshire (#Berkshire  England) http://t.co/WxWsaULRHl #Jobs
6.509210381135872E17,51.5072,-0.1275,Circumstances surrounding Noah during his Ark build: The Bible says that the time of Noah was a… https://t.co/SXjG0axL08
6.5092109646891008E17,51.37944444,0.09944444,Wind 0 km/h ---. Barometer 1004.9 mb  Falling slowly. Temperature 13.8 °C. Rain today 0.3 mm. Humidity 92%
6.5092113766119014E17,51.40892941,-0.26046589,Great news about Tommy and Manager of Month award - he deserves it - well done him and his management team @KingstonianFC
6.5092116649702195E17,51.5072,-0.1275,#StreetStyle from #Soho #LFW on thebookmagazine #photographer #LucieDesmond #FashionWeek #SS16 @… https://t.co/vLNbI7HoBB
6.5092123796362854E17,51.50602178,-0.0179592,We start TOMORROW ✖ We'll be working with @_courtneyblack_ at Crossrail roof tomorrow at 6:30pm and… https://t.co/zuz8shCL55
6.5092125507641344E17,51.54192439,-0.15785387,‘He has a great future’ Wenger reveals big plans for Arsenal youngster http://t.co/8rfycpkRUb #London http://t.co/wYMeUxRMdv
6.5092126693368627E17,51.510173,-0.098438,#london #vsco #vscocam @ Millennium Bridge  London https://t.co/u1w9L3zKx1
6.5092135759780659E17,51.5001524,-0.1262362,#FacilitiesMgmt #Job alert: Engineering Office Coordinator - London Hilton on Park Lane | Hilton UK | #London http://t.co/viS4OR56Hx #Jobs
6.5092142215244186E17,51.46055556,-0.31444444,Grey and dark morning over Richmond @ Twickenham Bridge https://t.co/GyKktfygiW
6.5092152181748531E17,51.50641447,-0.20904955,Am thinking that a Labrador flash mob is pretty much exactly what Barbour jackets were designed for #labflashmob
6.509215843670016E17,51.51287735,-0.08658374,|| HAPPY || We are loving this smiley workout pic from @beabs7 Working out is a brilliant way to… https://t.co/TkroBsAyBn
6.5092158527308595E17,51.55665377,-0.27963254,"It's game day!" #family #love #friends  #americanfootballintheuk #nfl elainegodsman deanioki… https://t.co/emFJJLH9Xf
6.5092161022493082E17,51.5001524,-0.1262362,We're #hiring! Click to apply: Front Office Supervisor at Hilton London Kensington - http://t.co/OaAucIJeLf #Hospitality #London #Job #Jobs
6.5092163030299853E17,51.50013926,-0.12450144,George Osborne poaches former Blair ally Lord Adonis to head infrastructure… http://t.co/8s2sg7aNgB #Politics http://t.co/yMoKGjmRkg
6.5092163746270822E17,51.50013926,-0.12450144,Support growing in Commons for bombing Isis in Syria  says Hammond http://t.co/YjQxm0IyeW #Politics http://t.co/CBddG71eJp
6.5092171405084262E17,51.5072,-0.1275,Have a fantastic Monday...!   #positivity #positive #motivation #MaKINGCarnivalTV #MakingCarnival… https://t.co/YPngHogzrt
6.5092187942791168E17,51.44197393,-0.08955078,StockMarketWire XCH confirms approaches by Capita and Apollo Global http://t.co/72Fp8QFOb8 http://t.co/GJtVCdlZFY
6.5092188171383603E17,51.44197393,-0.08955078,StockMarketWire FLASH: Europa Oil & Gas losses rise http://t.co/rAvrF59Edh http://t.co/GJtVCdlZFY
6.5092188455335936E17,51.44197393,-0.08955078,StockMarketWire FLASH: Arian Silver resource estimate update http://t.co/s8RaWDEUW6 http://t.co/GJtVCdlZFY
6.5092188720835379E17,51.44197393,-0.08955078,StockMarketWire Trinity Mirror sees FY performance in line http://t.co/ZPd0t1jJP4 http://t.co/GJtVCdlZFY
6.5092188911678259E17,51.44197393,-0.08955078,StockMarketWire Experian confirms data breach http://t.co/lFjVd05quv http://t.co/GJtVCdlZFY
6.5092189153268122E17,51.44197393,-0.08955078,StockMarketWire Rolls-Royce continues Marine transformation http://t.co/RZqGFWj4Lv http://t.co/GJtVCdlZFY
6.5092189323976294E17,51.44197393,-0.08955078,StockMarketWire LGO's hike http://t.co/ABuzQVKySK http://t.co/GJtVCdlZFY
6.5092189522784256E17,51.44197393,-0.08955078,StockMarketWire Playtech updates on acquisition of Ava Trade Ltd http://t.co/aKqfIku9KR http://t.co/GJtVCdlZFY
6.5092189787029094E17,51.44197393,-0.08955078,StockMarketWire Allied Minds unit raises $33.6m http://t.co/wRedMM2qof http://t.co/GJtVCdlZFY
6.5092189975350067E17,51.44197393,-0.08955078,StockMarketWire MTW's deal http://t.co/7jywpGVdmY http://t.co/GJtVCdlZFY
6.5092192853077197E17,51.59034895,-0.09445969,#C2C performing at the #DMCWorldFinal @TheForum #KentishTown #London last night #4xWorldTeamChampions… https://t.co/21dnsYSFcO
6.5092193083345715E17,52.01302,0.347593,Fidelity by Regina Spektor is #nowplaying in The Plough Bar & Grill.
6.5092200471178445E17,51.44197393,-0.08955078,StockMarketWire Ryanair Holdings improves September traffic figures http://t.co/r4wjtQX0ek http://t.co/GJtVCdlZFY
6.5092203215929754E17,51.44197393,-0.08955078,StockMarketWire Hargreaves Services' markets remain weak http://t.co/xkIgzUgyuY http://t.co/GJtVCdlZFY
6.5092203353083494E17,51.44197393,-0.08955078,StockMarketWire Wizz Air issues September 2015 traffic statistics http://t.co/3rGOae53yB http://t.co/GJtVCdlZFY
6.5092203490240102E17,51.44197393,-0.08955078,StockMarketWire CLS acquires Sutton office block for Â£10.2m http://t.co/KVLDKHWHm5 http://t.co/GJtVCdlZFY
6.5092203687366246E17,51.44197393,-0.08955078,StockMarketWire Ithaca Energ capex reduced to $120m http://t.co/BsIvq1AGw6 http://t.co/GJtVCdlZFY
6.5092203832071782E17,51.44197393,-0.08955078,StockMarketWire Retail sale of Lloyds shares planned for next spring http://t.co/oF2BhSCf1B http://t.co/GJtVCdlZFY
6.5092203972581376E17,51.44197393,-0.08955078,StockMarketWire ADAM to invest a further $3m in Adamas' GCCF http://t.co/MpTR6bXi6x http://t.co/GJtVCdlZFY
6.5092204122741555E17,51.44197393,-0.08955078,StockMarketWire MX Oil gives Mexico update http://t.co/5naDevv4tL http://t.co/GJtVCdlZFY
6.5092204251087258E17,51.44197393,-0.08955078,StockMarketWire Alexander Mining resumes trading on AIM http://t.co/92ju1FI8a9 http://t.co/GJtVCdlZFY
6.5092207479452058E17,51.830672,-0.602478,Nice day for 5 minutes of agony #hemelhillclimb http://t.co/eMmISXKVpx
6.5092215291345306E17,51.58706087,-0.33242589,#morning @ Harrow Road https://t.co/zJXSmfu3Ak
6.5092221399509402E17,51.55788134,-0.21363956,purple @ Cricklewood https://t.co/gRyGVpmdiY
6.5092221577769779E17,51.51089414,-0.14043128,It's going down! Turning #savilerow into a farm for the day. For the Wool… https://t.co/n908QanaPK
6.5092229596020736E17,51.55665377,-0.27963254,#nfluk2015 #wembelystadium @ Wembley Stadium https://t.co/G5bWifTYgA
6.5092234846029005E17,51.53144056,-0.12604237,I'm at Eurostar Business Premier Lounge in London  Greater London https://t.co/FN0HwUfq2I
6.5092239302893978E17,51.51901699,-0.1266379,The security guard smiled when she saw me do a handstand  then Josh got told off for juggling.. Photo… https://t.co/Xsbcrv2UEX
6.5092241303160422E17,51.52673847,-0.11378799,And there it is again...#Monday morning and a chilly one too ❄️❄️❄️
6.5092249385583411E17,51.5309312,-0.1316816,Right  off to @uclh Macmillan Centre for an early morning appointment.
6.5092266920706458E17,51.75,-0.333333,#commission #glassguild #christening #present for @mmoverz #graphicdesign #design #handtype… https://t.co/PwGSCD0qqn
6.5092267804435251E17,51.5063,-0.1271,Trend Alert: 'Lloyds Bank'. More trends at http://t.co/do7Hdxwcnc #trndnl http://t.co/NTFWcQsWum
6.509226807790633E17,51.5063,-0.1271,Trend Alert: 'Palmyra'. More trends at http://t.co/do7Hdxwcnc #trndnl http://t.co/a6V0lAT2Zv
6.509227296553984E17,51.4798766,-0.4504854,the miami dolphin cheerleaders are on our flight?????
6.5092282200968397E17,51.5683,-0.1031,Shoulders this morning just went down (eventually) - I say eventually because  as is true for many… https://t.co/bIQI2KIWVB
6.509228546540585E17,51.58888917,-0.55085367,I'm at @CostaCoffee in Gerrards Cross  Buckinghamshire https://t.co/JF1p8itWdo
6.5092285892384768E17,51.4998211,-0.16281907,Yes!  #Harrods #harrodslondon @ Harrods https://t.co/Hw6VxWcQgd
6.5092286878466048E17,51.9,0.0166667,There's always more to explore. #Hertfordshire #countrywalks #englishcountryside #VSCOcam… https://t.co/BlItG8QUGv
6.5092289410974106E17,51.750789,-0.33948975,Google Lets Advertisers Target By (Anonymized) Customer Data http://t.co/XVK5q3q2cf #business #marketing
6.5092291499751014E17,51.51605245,-0.08102719,Breakfast tempo is too early for me today 🙌 @ Duck & Waffle https://t.co/aj4fUOvKAD
6.5092293593967411E17,51.47010769,-0.46056118,LHR ✈️ JFK - looking forward to the week - big tings (at @VirginAtlantic Clubhouse in Hounslow  Middlesex) https://t.co/CeZrRVAPas
6.5092298505497395E17,51.51,-0.13444444,Piccadilly Circus. Brimming with people. #london #england #unitedkingdom #greatbritain… https://t.co/HXHFTHtcLG
6.509230665628672E17,51.49937617,-0.18193126,Out Today: #FT New Africa special report  http://t.co/lktjbxTP1p http://t.co/mKUmkyDuf0
6.5092307964899738E17,51.53078864,-0.22496748,All Sparks 💥 @ Kensal Green London Underground and London Overground Station https://t.co/B0dSsUqTo5
6.509231776572375E17,51.74972626,-0.34017639,M25 clockwise between J9 and J10 | Clockwise | Congestion: On the M25 clockwise between… http://t.co/9uXvRJGiYr #stalbans #harpenden
6.5092317993478144E17,51.74972626,-0.34017639,M25 anti-clockwise between J22 and J21A | Anti-clockwise | Congestion: On the M25… http://t.co/SANJkDyHl0 #stalbans #harpenden
6.5092318209903411E17,51.74972626,-0.34017639,M25 anti-clockwise within J27 before M11 J6 southbound access | Anti-clockwise | Congestion:… http://t.co/Fxqy8XX3sj #stalbans #harpenden
6.5092318372644454E17,51.74972626,-0.34017639,M25 anti-clockwise between J28 and J27 | Anti-clockwise | Congestion: On the M25… http://t.co/BRosJNIH9v #stalbans #harpenden
6.5092319790314701E17,51.5063,-0.1271,@monte60519 the 1st mention of 'Lloyds Bank' appears on your TL. Now is Trending Topic in United Kingdom! #trndnl
6.5092321765429658E17,51.554207,-0.110357,@RadioX #RadioX Chris and Rob DJ having a Netflix and Chill !!
6.5092324059700838E17,51.5063,-0.1271,819 users and 965 tweets (482 RTs) in 2 weeks made 'Lloyds Bank' a Trending Topic in United Kingdom. #trndnl
